main;Соблюдены ли правила производства?;Конечно! И это подтверждено оффициальными декларациями, которые перечислены на сайте: https://декларации-соответствия.рус/kompaniya/ip-iakimov-kirill-vasilevich-inn-598100672989/
main;Как работает дропшипинг?;"Вам не нужно выделять склад на хранение товаров, продумывать логистику, производить товар и заниматься всем головняком, что лежит на плечах обычных магазинов - все это делает поставщик, то есть мы🙂
Вам остается лишь выложить товар в поле обозрения клиентов (маркетплейсы, интернет-магазин, оффлайн-магазин и так далее) и продвигать свой магазин
Это самый простой способ начать свой бизнес, а начать его можно обратившись к @amanita_viking или оставив заявку в поддержке"
main;Есть отзывы?;Поспрашивать отзывы у других можно в чате: https://t.me/+b-L2PaoJhnplMGYy
main;Как мне задать свой вопрос и узнать подробности?;"Для информации о дропшипинге обратитесь в поддержку
Для получения информации о товаре напишите в чат: https://t.me/+b-L2PaoJhnplMGYy"
